<?xml version="1.0" encoding="UTF-8"?>
<!--
Copyright 2014 Jason Sorensen <sorensenj@smert.net>.

Licensed under the Apache License, Version 2.0 (the "License");
you may not use this file except in compliance with the License.
You may obtain a copy of the License at

     http://www.apache.org/licenses/LICENSE-2.0

Unless required by applicable law or agreed to in writing, software
distributed under the License is distributed on an "AS IS" BASIS,
WITHOUT WARRANTIES OR CONDITIONS OF ANY KIND, either express or implied.
See the License for the specific language governing permissions and
limitations under the License.
-->


<clumsyRoot
    xmlns:xsi='http://www.w3.org/2001/XMLSchema-instance'
    xmlns='https://github.com/kovertopz/Framework-GL'
    xsi:schemaLocation='https://github.com/kovertopz/Framework-GL ../../../../../../../../../../src/main/resources/net/smert/frameworkgl/assets/gui/clumsyGui.xsd'>

    <screen id="derp">

        <panel padding="3px 44454px 4px 5px" zIndex="0">
            <panel>
            </panel>  
            <panel>
                <control type="button" />
            </panel>  
            <panel>
                <text text="SHDFDF" />
            </panel>
        </panel>

    </screen>

</clumsyRoot>
